{
  "task_id": "TASK-2026-0001-bootstrap",
  "slug": "bootstrap",
  "title": "Ядро loom — bootstrap",
  "description": "Спроектировать и реализовать ядро loom — AI-Native Development Environment для pi. Система разработки с помощью ИИ-агентов, оптимизированная под восприятие LLM, с накоплением знаний и артефактов.",
  "status": "in_progress",
  "priority": "critical",
  "branch": "task/task-2026-0001-bootstrap",
  "invariants": [
    {
      "id": "INV-1",
      "text": "AI-First: JSON primary, markdown derivative",
      "marker": "INVARIANT: JSON must be primary format for all knowledge artifacts; markdown is auto-generated derivative",
      "status": "verified",
      "verification_method": "All knowledge files exist as JSON in knowledge/; markdown files are derivatives with 'Generated from {json_path}' header"
    },
    {
      "id": "INV-2",
      "text": "Stack-Agnostic: система не знает о языке/фреймворке",
      "marker": "INVARIANT: No language-specific branching logic in extension code",
      "status": "verified",
      "verification_method": "Code review: no if (language === 'rust') in extension; domain detection via file extensions only"
    },
    {
      "id": "INV-3",
      "text": "Legacy/Greenfield parity: onboarding работает в пустом и непустом проекте",
      "marker": "INVARIANT: Onboarding pipeline must handle clean, partial, foreign_system, mixed_system, compatible states",
      "status": "defined",
      "verification_method": "Onboarding test on empty repo, repo with AGENTS.md, repo with task-centric-knowledge"
    },
    {
      "id": "INV-4",
      "text": "Task-Centric накопление: каждая задача = атом, знания наследуются",
      "marker": "INVARIANT: Every task has task.json; registry.json is updated; closed tasks are read by agents",
      "status": "verified",
      "verification_method": "Registry contains all tasks; agent prompt includes 'read closed tasks' instruction"
    },
    {
      "id": "INV-5",
      "text": "Operator слои: read-only TUI, docs-as-code",
      "marker": "INVARIANT: TUI widgets do not allow code editing; operator interacts via commands and read-only reports",
      "status": "defined",
      "verification_method": "UI audit: no edit tools in operator-facing widgets; docs generated from code"
    },
    {
      "id": "INV-6",
      "text": "Детерминированный контекст: нет неявного состояния",
      "marker": "INVARIANT: Subagents use clean sessions; context is assembled from explicit files, not implicit state",
      "status": "verified",
      "verification_method": "Subagent spawner uses --no-context-files; context injected via inputArtifact only"
    },
    {
      "id": "INV-7",
      "text": "Pi-Native: extension, не standalone tool",
      "marker": "INVARIANT: All code lives in .pi/extensions/loom/; single agent with different prompts per mode",
      "status": "defined",
      "verification_method": "File system check: extension files under .pi/extensions/loom/ only"
    },
    {
      "id": "INV-8",
      "text": "Git-based review: reviewer анализирует артефакты, не сессию",
      "marker": "INVARIANT: Review artifact references git commit hash; reviewer analyzes git diff, not live session",
      "status": "verified",
      "verification_method": "Review.json contains target.commit; reviewer tools: git show, read file, write review.json"
    },
    {
      "id": "INV-9",
      "text": "Executor не пишет код: только оркестрирует worker + reviewer",
      "marker": "INVARIANT: Executor tools: spawn_worker, spawn_reviewer, update_task_status, read_artifact. NO write/edit/commit in executor tools",
      "status": "verified",
      "verification_method": "Executor prompt explicitly lists allowed tools; write/edit excluded"
    },
    {
      "id": "INV-10",
      "text": "Модели конфигурируются: не хардкод",
      "marker": "INVARIANT: Model config in subagent-config.json; no hardcoded model strings in extension code",
      "status": "verified",
      "verification_method": "Code review: all model references load from subagent-config.json"
    },
    {
      "id": "INV-11",
      "text": "Исполнение строго последовательное: шаг N → worker → reviewer → шаг N+1",
      "marker": "INVARIANT: Executor loop cannot spawn more than one worker simultaneously",
      "status": "verified",
      "verification_method": "Executor loop state machine: single active_worker_id; new spawn blocked while active"
    },
    {
      "id": "INV-12",
      "text": "Локализация: UI и пользовательские артефакты — русский; AI-документация — английский",
      "marker": "INVARIANT: All system prompts, JSON schemas, code comments in English; operator-facing text in Russian; machine markers in English",
      "status": "defined",
      "verification_method": "Localization guard check on all markdown derivatives; English-only audit on schemas and prompts"
    },
    {
      "id": "INV-13",
      "text": "Git commit safety: не git add -A, а staged по списку",
      "marker": "INVARIANT: Worker commits only files listed in files-to-commit.json; no mass add",
      "status": "defined",
      "verification_method": "Worker writes files-to-commit.json; git add --pathspec-from-file; executor validates against plan expected_output"
    }
  ],
  "delivery_units": [
    {
      "id": "DU-1",
      "status": "merged",
      "purpose": "Core design: architecture, data model, artifact formats, invariants, JSON schemas. Result: sdd.json + schemas/",
      "base_branch": "main"
    },
    {
      "id": "DU-2",
      "status": "draft",
      "purpose": "Implementation: extension, Plan Mode, Agent Mode, subagent spawner, git review flow",
      "base_branch": "main"
    },
    {
      "id": "DU-3",
      "status": "planned",
      "purpose": "Onboarding: scout, research, migration, rules catalog, architecture catalog",
      "base_branch": "main"
    },
    {
      "id": "DU-4",
      "status": "planned",
      "purpose": "Polish: TUI widgets, localization guard integration, verification matrix, subagent config editor",
      "base_branch": "main"
    }
  ],
  "created_at": "2026-05-21",
  "updated_at": "2026-05-23",
  "schema_version": "1.0.0"
}
